{
  "freeze_date": "2026-05-22",
  "protocol_id": "cagap-ten-subject-family-excluded-judges-2026-05-22",
  "note": "Single source of truth for the 10-subject main-run roster: 5 hosted/API subjects (Claude Opus 4.7, GPT-5.5, Gemini 3.5 Flash, Grok 4.3, Kimi K2.6) and 5 local/self-hosted subjects (Llama 3.3-70B-Instruct, Gemma 4 31B IT, Qwen 3.6 35B-A3B, GLM-4.7-Flash, Mistral Medium 3.5 128B). The primary estimand remains the within-subject TOOL versus DISABLED contrast; DISABLED means schemas remain model-visible while relevant tool calls are disabled. Hosted/API versus local/self-hosted is a pre-registered descriptive heterogeneity stratum, not a causal serving-context comparison. Sen-Q is the paired local/self-hosted primary-vs-4-bit deployment-path audit on the predeclared 96-prompt subset and covers all five local subjects, including GLM-4.7-Flash and Mistral Medium 3.5 128B. Quantization-audit rows carry serving_precision_role=quantization_audit and are excluded from H1. Chat-path judging uses subject-level family exclusion: default judges are GLM 5.1, Cohere Command A, and Mistral Large 3; a same-family judge is replaced for the entire subject by GPT-5.5 judge, then Claude Opus 4.7 judge if needed. Predicate-graded structured rows do not route to substitute judges. Rejected candidates and route-failure reasons are retained under archived_models.",
  "default_route": "native",
  "openrouter_base_url": "https://openrouter.ai/api/v1",
  "openrouter_auth_env": "OPENROUTER_API_KEY",
  "subjects": {
    "claude-opus-4-7": {
      "display_name": "Claude Opus 4.7",
      "family": "anthropic",
      "tier": "hosted_api",
      "hosted_route_class": "closed_frontier_api",
      "native": {
        "endpoint": "https://api.anthropic.com",
        "url_path": "/v1/messages",
        "slug": "claude-opus-4-7",
        "auth_env": "ANTHROPIC_API_KEY",
        "supports_batch": true,
        "batch_url_path": "/v1/messages/batches",
        "batch_discount": 0.5,
        "headers": {
          "anthropic-version": "2023-06-01"
        },
        "schema_visibility_audit": {
          "route_label": "claude-opus-4-7::native",
          "disabled_arm_schema_visibility": "schema_visible",
          "route_support_status": "supported",
          "evidence_id": "outputs/pilot/2026-05-19/schema_visibility_smoke/20260519T223440Z/schema_visibility_classification.json",
          "evidence_sha256": "120c66ab61e8d811530b128b5b176fd16fa056025205ed6d12390e3b001cb260"
        }
      },
      "openrouter": {
        "slug": "anthropic/claude-opus-4.7",
        "pinned_provider": "anthropic"
      },
      "route_override": null
    },
    "gpt-5.5": {
      "display_name": "GPT-5.5",
      "family": "openai",
      "tier": "hosted_api",
      "hosted_route_class": "closed_frontier_api",
      "selection_note": "Hosted/API subject selected on the OpenRouter route after route audit; native GPT-5.5 was unsupported for the DISABLED schema-visibility arm in outputs/pilot/2026-05-19/schema_visibility_smoke/20260519T223440Z, while gpt-5.5::openrouter preserved model-visible schema.",
      "native": {
        "endpoint": "https://api.openai.com",
        "url_path": "/v1/chat/completions",
        "slug": "gpt-5.5",
        "auth_env": "OPENAI_API_KEY",
        "supports_batch": true,
        "batch_url_path": "/v1/batches",
        "batch_input_files_path": "/v1/files",
        "batch_discount": 0.5
      },
      "openrouter": {
        "slug": "openai/gpt-5.5",
        "pinned_provider": "openai",
        "schema_visibility_audit": {
          "route_label": "gpt-5.5::openrouter",
          "disabled_arm_schema_visibility": "schema_visible",
          "route_support_status": "supported",
          "evidence_id": "outputs/pilot/2026-05-19/schema_visibility_smoke/20260519T223440Z/schema_visibility_classification.json",
          "evidence_sha256": "120c66ab61e8d811530b128b5b176fd16fa056025205ed6d12390e3b001cb260"
        }
      },
      "route_override": "openrouter"
    },
    "gemini-3.5-flash": {
      "display_name": "Gemini 3.5 Flash",
      "family": "google",
      "tier": "hosted_api",
      "hosted_route_class": "closed_frontier_api",
      "selection_note": "Hosted/API subject selected after route audit. OpenRouter model id google/gemini-3.5-flash with pinned provider google-ai-studio is locked as the runtime route; archived canary evidence lives at outputs/pilot/2026-05-20/schema_visibility_smoke/gemini35_flash_20260520T004107Z. Cite the returned model id and route metadata rather than relying on press/product naming.",
      "native": null,
      "openrouter": {
        "slug": "google/gemini-3.5-flash",
        "pinned_provider": "google-ai-studio",
        "schema_visibility_audit": {
          "route_label": "gemini-3.5-flash::openrouter::google-ai-studio",
          "disabled_arm_schema_visibility": "schema_visible",
          "route_support_status": "supported",
          "evidence_id": "outputs/pilot/2026-05-20/schema_visibility_smoke/gemini35_flash_20260520T004107Z/classification.json",
          "evidence_sha256": "ccc6dae95c9a83ee53a0334ccdabff8b169b083e14db3b8458876ff577b60962"
        }
      },
      "route_override": "openrouter"
    },
    "grok-4.3": {
      "display_name": "Grok 4.3",
      "family": "xai",
      "tier": "hosted_api",
      "hosted_route_class": "closed_frontier_api",
      "selection_note": "xAI Grok 4.3 \u2014 hosted/API subject. Native batch supported through the HTTP Batch API: upload JSONL to /v1/files, create/poll/fetch via /v1/batches. Friendly slug `grok-4.3` accepted by both batch and online surfaces. Reasoning levels {none, low, medium, high} configurable. Tool/function calling supported. Promotion of xAI to the subject family is paired with the predeclared family-excluded judge-routing rule.",
      "native": {
        "endpoint": "https://api.x.ai",
        "url_path": "/v1/chat/completions",
        "slug": "grok-4.3",
        "batch_slug": "grok-4.3",
        "auth_env": "X_API_KEY",
        "supports_batch": true,
        "batch_transport": "xai-http",
        "batch_url_path": "/v1/batches",
        "batch_input_files_path": "/v1/files",
        "batch_results_path": "/v1/batches/{batch_id}/results",
        "batch_state_path": "/v1/batches/{batch_id}",
        "batch_discount": 0.5,
        "batch_completion_sla_hours": 24,
        "batch_max_file_mb": 200,
        "batch_max_requests_per_file": 50000,
        "batch_note": "HTTP Batch API transport: upload a JSONL request file to /v1/files with purpose=batch, create the batch at /v1/batches using input_file_id, poll /v1/batches/{batch_id}, and fetch /v1/batches/{batch_id}/results. Per xAI docs.x.ai/operator verification on 2026-05-23, grok-4.3 friendly slug is accepted at both batch and online surfaces and the planned bulk dispatch uses the user-verified 50% batch-discount case.",
        "schema_visibility_audit": {
          "route_label": "grok-4.3::native",
          "disabled_arm_schema_visibility": "schema_visible",
          "route_support_status": "supported",
          "evidence_id": "outputs/pilot/2026-05-19/schema_visibility_smoke/20260519T223440Z/schema_visibility_classification.json",
          "evidence_sha256": "120c66ab61e8d811530b128b5b176fd16fa056025205ed6d12390e3b001cb260"
        }
      },
      "openrouter": {
        "slug": "x-ai/grok-4.3",
        "pinned_provider": "xai"
      },
      "route_override": null
    },
    "kimi-k2.6": {
      "display_name": "Kimi K2.6",
      "family": "moonshot",
      "tier": "hosted_api",
      "hosted_route_class": "open_weight_hosted_api",
      "selection_note": "Open-weight ~1T-MoE hosted/API subject (Modified MIT, HF moonshotai/Kimi-K2.6), selected as an agentic-post-trained model for the conversation-action gap panel. Tool_call_id format `functions.{name}:{idx}` differs from OpenAI's opaque ids; downstream extractor parser must accept this when wired. With thinking enabled, `tool_choice` only accepts `auto` or `none` (compatible with all four study arms).",
      "native": {
        "endpoint": "https://api.moonshot.ai",
        "url_path": "/v1/chat/completions",
        "slug": "kimi-k2.6",
        "auth_env": "MOONSHOT_API_KEY",
        "supports_batch": true,
        "batch_url_path": "/v1/batches",
        "batch_input_files_path": "/v1/files",
        "batch_discount": 0.4,
        "batch_note": "OpenAI-compatible Batch API (purpose=batch JSONL, /v1/batches). 40% discount per provider pricing reference.",
        "schema_visibility_audit": {
          "route_label": "kimi-k2.6::native",
          "disabled_arm_schema_visibility": "schema_visible",
          "route_support_status": "supported",
          "evidence_id": "outputs/pilot/2026-05-19/schema_visibility_smoke/20260519T230041Z/schema_visibility_classification.json",
          "evidence_sha256": "9324da132aa6efcf3576850254311f3432a9d2dd012c381a2f2698956e85a453"
        }
      },
      "openrouter": {
        "slug": "moonshotai/kimi-k2.6",
        "pinned_provider": "moonshotai/int4"
      },
      "route_override": null,
      "ollama_cloud": {
        "endpoint": "https://ollama.com",
        "url_path": "/v1/chat/completions",
        "slug": "kimi-k2.6:cloud",
        "auth_env": "OLLAMA_API_KEY",
        "digest_prefix": "a90cd0d1590",
        "context_window_tokens": 256000,
        "modalities": [
          "text",
          "image"
        ],
        "supports_batch": false,
        "note": "Ollama Cloud secondary route for Kimi K2.6. Auth via OLLAMA_API_KEY."
      },
      "route_preference": [
        "native",
        "ollama_cloud",
        "openrouter"
      ]
    },
    "llama-3.3-70b-instruct": {
      "display_name": "Llama 3.3-70B Instruct",
      "family": "meta",
      "tier": "local_self_hosted",
      "native": null,
      "openrouter": null,
      "route_override": null,
      "local_config": {
        "hf_repo": "meta-llama/Llama-3.3-70B-Instruct",